book_id,title,subtitle,authors,publisher,published_date,description,page_count,categories,average_rating,ratings_count,language,preview_link,info_link,isbn_13,isbn_10,list_price,currency,buyable,search_category,thumbnail,published_year
-eqpCAAAQBAJ,Machine Learning,An Artificial Intelligence Approach,"R.S. Michalski, J.G. Carbonell, T.M. Mitchell",Springer Science & Business Media,2013-04-17,"The ability to learn is one of the most fundamental attributes of intelligent behavior. Consequently, progress in the theory and computer modeling of learn ing processes is of great significance to fields concerned with understanding in telligence. Such fields include cognitive science, artificial intelligence, infor mation science, pattern recognition, psychology, education, epistemology, philosophy, and related disciplines. The recent observance of the silver anniversary of artificial intelligence has been heralded by a surge of interest in machine learning-both in building models of human learning and in understanding how machines might be endowed with the ability to learn. This renewed interest has spawned many new research projects and resulted in an increase in related scientific activities. In the summer of 1980, the First Machine Learning Workshop was held at Carnegie-Mellon University in Pittsburgh. In the same year, three consecutive issues of the Inter national Journal of Policy Analysis and Information Systems were specially devoted to machine learning (No. 2, 3 and 4, 1980). In the spring of 1981, a special issue of the SIGART Newsletter No. 76 reviewed current research projects in the field. . This book contains tutorial overviews and research papers representative of contemporary trends in the area of machine learning as viewed from an artificial intelligence perspective. As the first available text on this subject, it is intended to fulfill several needs.",564.0,Computers,2.0,1,en,http://books.google.com/books?id=-eqpCAAAQBAJ&printsec=frontcover&dq=machine+learning+AI&hl=&cd=3&source=gbs_api,https://play.google.com/store/books/details?id=-eqpCAAAQBAJ&source=gbs_api,9783662124055.0,366212405X,129.0,USD,False,machine learning AI,http://books.google.com/books/content?id=-eqpCAAAQBAJ&printsec=frontcover&img=1&zoom=1&edge=curl&source=gbs_api,2013
ozDnDwAAQBAJ,Hands-On Machine Learning with C++,"Build, train, and deploy end-to-end machine learning and deep learning pipelines",Kirill Kolodiazhnyi,Packt Publishing Ltd,2020-05-15,"Implement supervised and unsupervised machine learning algorithms using C++ libraries such as PyTorch C++ API, Caffe2, Shogun, Shark-ML, mlpack, and dlib with the help of real-world examples and datasets Key Features Become familiar with data processing, performance measuring, and model selection using various C++ libraries Implement practical machine learning and deep learning techniques to build smart models Deploy machine learning models to work on mobile and embedded devices Book DescriptionC++ can make your machine learning models run faster and more efficiently. This handy guide will help you learn the fundamentals of machine learning (ML), showing you how to use C++ libraries to get the most out of your data. This book makes machine learning with C++ for beginners easy with its example-based approach, demonstrating how to implement supervised and unsupervised ML algorithms through real-world examples. This book will get you hands-on with tuning and optimizing a model for different use cases, assisting you with model selection and the measurement of performance. You’ll cover techniques such as product recommendations, ensemble learning, and anomaly detection using modern C++ libraries such as PyTorch C++ API, Caffe2, Shogun, Shark-ML, mlpack, and dlib. Next, you’ll explore neural networks and deep learning using examples such as image classification and sentiment analysis, which will help you solve various problems. Later, you’ll learn how to handle production and deployment challenges on mobile and cloud platforms, before discovering how to export and import models using the ONNX format. By the end of this C++ book, you will have real-world machine learning and C++ knowledge, as well as the skills to use C++ to build powerful ML systems.What you will learn Explore how to load and preprocess various data types to suitable C++ data structures Employ key machine learning algorithms with various C++ libraries Understand the grid-search approach to find the best parameters for a machine learning model Implement an algorithm for filtering anomalies in user data using Gaussian distribution Improve collaborative filtering to deal with dynamic user preferences Use C++ libraries and APIs to manage model structures and parameters Implement a C++ program to solve image classification tasks with LeNet architecture Who this book is for You will find this C++ machine learning book useful if you want to get started with machine learning algorithms and techniques using the popular C++ language. As well as being a useful first course in machine learning with C++, this book will also appeal to data analysts, data scientists, and machine learning developers who are looking to implement different machine learning models in production using varied datasets and examples. Working knowledge of the C++ programming language is mandatory to get started with this book.",515.0,Computers,5.0,1,en,http://books.google.com/books?id=ozDnDwAAQBAJ&printsec=frontcover&dq=machine+learning+AI&hl=&cd=180&source=gbs_api,https://play.google.com/store/books/details?id=ozDnDwAAQBAJ&source=gbs_api,9781789952476.0,1789952476,47.99,USD,True,machine learning AI,http://books.google.com/books/content?id=ozDnDwAAQBAJ&printsec=frontcover&img=1&zoom=1&edge=curl&source=gbs_api,2020
yPt9DwAAQBAJ,Learn Keras for Deep Neural Networks,A Fast-Track Approach to Modern Deep Learning with Python,Jojo Moolayil,Apress,2018-12-07,"Learn, understand, and implement deep neural networks in a math- and programming-friendly approach using Keras and Python. The book focuses on an end-to-end approach to developing supervised learning algorithms in regression and classification with practical business-centric use-cases implemented in Keras. The overall book comprises three sections with two chapters in each section. The first section prepares you with all the necessary basics to get started in deep learning. Chapter 1 introduces you to the world of deep learning and its difference from machine learning, the choices of frameworks for deep learning, and the Keras ecosystem. You will cover a real-life business problem that can be solved by supervised learning algorithms with deep neural networks. You’ll tackle one use case for regression and another for classification leveraging popular Kaggle datasets. Later, you will see an interesting and challenging part of deep learning: hyperparameter tuning; helping you further improve your models when building robust deep learning applications. Finally, you’ll further hone your skills in deep learning and cover areas of active development and research in deep learning. At the end of Learn Keras for Deep Neural Networks, you will have a thorough understanding of deep learning principles and have practical hands-on experience in developing enterprise-grade deep learning solutions in Keras. What You’ll Learn Master fast-paced practical deep learning concepts with math- and programming-friendly abstractions. Design, develop, train, validate, and deploy deep neural networks using the Keras framework Use best practices for debugging and validating deep learning models Deploy and integrate deep learning as a service into a larger software service or product Extend deep learning principles into other popular frameworks Who This Book Is For Software engineers and data engineers with basic programming skills in any language and who are keen on exploring deep learning for a career move or an enterprise project.",192.0,Computers,5.0,1,en,http://books.google.com/books?id=yPt9DwAAQBAJ&printsec=frontcover&dq=deep+learning&hl=&cd=19&source=gbs_api,https://play.google.com/store/books/details?id=yPt9DwAAQBAJ&source=gbs_api,9781484242407.0,1484242408,44.99,USD,False,deep learning,http://books.google.com/books/content?id=yPt9DwAAQBAJ&printsec=frontcover&img=1&zoom=1&edge=curl&source=gbs_api,2018
RrZTDwAAQBAJ,TensorFlow Deep Learning Projects,"10 real-world projects on computer vision, machine translation, chatbots, and reinforcement learning","Alexey Grigorev, Rajalingappaa Shanmugamani, Alberto Boschetti, Luca Massaron, Abhishek Thakur",Packt Publishing Ltd,2018-03-28,"Leverage the power of Tensorflow to design deep learning systems for a variety of real-world scenarios Key Features Build efficient deep learning pipelines using the popular Tensorflow framework Train neural networks such as ConvNets, generative models, and LSTMs Includes projects related to Computer Vision, stock prediction, chatbots and more Book Description TensorFlow is one of the most popular frameworks used for machine learning and, more recently, deep learning. It provides a fast and efficient framework for training different kinds of deep learning models, with very high accuracy. This book is your guide to master deep learning with TensorFlow with the help of 10 real-world projects. TensorFlow Deep Learning Projects starts with setting up the right TensorFlow environment for deep learning. Learn to train different types of deep learning models using TensorFlow, including Convolutional Neural Networks, Recurrent Neural Networks, LSTMs, and Generative Adversarial Networks. While doing so, you will build end-to-end deep learning solutions to tackle different real-world problems in image processing, recommendation systems, stock prediction, and building chatbots, to name a few. You will also develop systems that perform machine translation, and use reinforcement learning techniques to play games. By the end of this book, you will have mastered all the concepts of deep learning and their implementation with TensorFlow, and will be able to build and train your own deep learning models with TensorFlow confidently. What you will learn Set up the TensorFlow environment for deep learning Construct your own ConvNets for effective image processing Use LSTMs for image caption generation Forecast stock prediction accurately with an LSTM architecture Learn what semantic matching is by detecting duplicate Quora questions Set up an AWS instance with TensorFlow to train GANs Train and set up a chatbot to understand and interpret human input Build an AI capable of playing a video game by itself –and win it! Who this book is for This book is for data scientists, machine learning developers as well as deep learning practitioners, who want to build interesting deep learning projects that leverage the power of Tensorflow. Some understanding of machine learning and deep learning, and familiarity with the TensorFlow framework is all you need to get started with this book.",310.0,Computers,1.0,1,en,http://books.google.com/books?id=RrZTDwAAQBAJ&printsec=frontcover&dq=deep+learning&hl=&cd=60&source=gbs_api,https://play.google.com/store/books/details?id=RrZTDwAAQBAJ&source=gbs_api,9781788398381.0,1788398386,35.99,USD,True,deep learning,http://books.google.com/books/content?id=RrZTDwAAQBAJ&printsec=frontcover&img=1&zoom=1&edge=curl&source=gbs_api,2018
DNO1DgAAQBAJ,Hacking the Hacker,Learn From the Experts Who Take Down Hackers,Roger A. Grimes,John Wiley & Sons,2017-04-19,"Meet the world's top ethical hackers and explore the tools of the trade Hacking the Hacker takes you inside the world of cybersecurity to show you what goes on behind the scenes, and introduces you to the men and women on the front lines of this technological arms race. Twenty-six of the world's top white hat hackers, security researchers, writers, and leaders, describe what they do and why, with each profile preceded by a no-experience-necessary explanation of the relevant technology. Dorothy Denning discusses advanced persistent threats, Martin Hellman describes how he helped invent public key encryption, Bill Cheswick talks about firewalls, Dr. Charlie Miller talks about hacking cars, and other cybersecurity experts from around the world detail the threats, their defenses, and the tools and techniques they use to thwart the most advanced criminals history has ever seen. Light on jargon and heavy on intrigue, this book is designed to be an introduction to the field; final chapters include a guide for parents of young hackers, as well as the Code of Ethical Hacking to help you start your own journey to the top. Cybersecurity is becoming increasingly critical at all levels, from retail businesses all the way up to national security. This book drives to the heart of the field, introducing the people and practices that help keep our world secure. Go deep into the world of white hat hacking to grasp just how critical cybersecurity is Read the stories of some of the world's most renowned computer security experts Learn how hackers do what they do—no technical expertise necessary Delve into social engineering, cryptography, penetration testing, network attacks, and more As a field, cybersecurity is large and multi-faceted—yet not historically diverse. With a massive demand for qualified professional that is only going to grow, opportunities are endless. Hacking the Hacker shows you why you should give the field a closer look.",324.0,Computers,4.5,4,en,http://books.google.com/books?id=DNO1DgAAQBAJ&printsec=frontcover&dq=cybersecurity+hacking&hl=&cd=3&source=gbs_api,https://play.google.com/store/books/details?id=DNO1DgAAQBAJ&source=gbs_api,9781119396239.0,1119396239,16.0,USD,True,cybersecurity hacking,http://books.google.com/books/content?id=DNO1DgAAQBAJ&printsec=frontcover&img=1&zoom=1&edge=curl&source=gbs_api,2017
EvcgDgAAQBAJ,The Cybersecurity Dilemma,"Hacking, Trust and Fear Between Nations",Ben Buchanan,Oxford University Press,2017-02-01,"This book examines how cyber conflict could happen--even if no nation desires it. It applies the security dilemma, a long-standing idea in international relations, to cybersecurity. Drawing on a detailed analysis of leaked classified documents and cybersecurity forensic reports, this book shows how nations' methods of defending themselves in other states risk unintentionally threatening other nations and risking escalation.",300.0,Political Science,5.0,2,en,http://books.google.com/books?id=EvcgDgAAQBAJ&printsec=frontcover&dq=cybersecurity+hacking&hl=&cd=19&source=gbs_api,https://play.google.com/store/books/details?id=EvcgDgAAQBAJ&source=gbs_api,9780190694807.0,0190694807,25.99,USD,True,cybersecurity hacking,http://books.google.com/books/content?id=EvcgDgAAQBAJ&printsec=frontcover&img=1&zoom=1&edge=curl&source=gbs_api,2017
YRIeASgVUJoC,Cloud Computing,"Implementation, Management, and Security","John W. Rittinghouse, James F. Ransome",CRC Press,2016-04-19,"Cloud Computing: Implementation, Management, and Security provides an understanding of what cloud computing really means, explores how disruptive it may become in the future, and examines its advantages and disadvantages. It gives business executives the knowledge necessary to make informed, educated decisions regarding cloud initiatives. The authors first discuss the evolution of computing from a historical perspective, focusing primarily on advances that led to the development of cloud computing. They then survey some of the critical components that are necessary to make the cloud computing paradigm feasible. They also present various standards based on the use and implementation issues surrounding cloud computing and describe the infrastructure management that is maintained by cloud computing service providers. After addressing significant legal and philosophical issues, the book concludes with a hard look at successful cloud computing vendors. Helping to overcome the lack of understanding currently preventing even faster adoption of cloud computing, this book arms readers with guidance essential to make smart, strategic decisions on cloud initiatives.",341.0,Business & Economics,3.0,4,en,http://books.google.com/books?id=YRIeASgVUJoC&printsec=frontcover&dq=cloud+computing&hl=&cd=12&source=gbs_api,https://play.google.com/store/books/details?id=YRIeASgVUJoC&source=gbs_api,9781439806814.0,1439806810,57.95,USD,True,cloud computing,http://books.google.com/books/content?id=YRIeASgVUJoC&printsec=frontcover&img=1&zoom=1&edge=curl&source=gbs_api,2016
SbSbdkqibwIC,Cloud Computing,"Principles, Systems and Applications","Nikos Antonopoulos, Lee Gillam",Springer Science & Business Media,2010-07-16,"Cloud computing continues to emerge as a subject of substantial industrial and academic interest. Although the meaning and scope of “cloud computing” continues to be debated, the current notion of clouds blurs the distinctions between grid services, web services, and data centers, among other areas. Clouds also bring considerations of lowering the cost for relatively bursty applications to the fore. Cloud Computing: Principles, Systems and Applications is an essential reference/guide that provides thorough and timely examination of the services, interfaces and types of applications that can be executed on cloud-based systems. The book identifies and highlights state-of-the-art techniques and methods for designing cloud systems, presents mechanisms and schemes for linking clouds to economic activities, and offers balanced coverage of all related technologies that collectively contribute towards the realization of cloud computing. With an emphasis on the conceptual and systemic links between cloud computing and other distributed computing approaches, this text also addresses the practical importance of efficiency, scalability, robustness and security as the four cornerstones of quality of service. Topics and features: explores the relationship of cloud computing to other distributed computing paradigms, namely peer-to-peer, grids, high performance computing and web services; presents the principles, techniques, protocols and algorithms that can be adapted from other distributed computing paradigms to the development of successful clouds; includes a Foreword by Professor Mark Baker of the University of Reading, UK; examines current cloud-practical applications and highlights early deployment experiences; elaborates the economic schemes needed for clouds to become viable business models. This book will serve as a comprehensive reference for researchers and students engaged in cloud computing. Professional system architects, technical managers, and IT consultants will also find this unique text a practical guide to the application and delivery of commercial cloud services. Prof. Nick Antonopoulos is Head of the School of Computing, University of Derby, UK. Dr. Lee Gillam is a Lecturer in the Department of Computing at the University of Surrey, UK.",386.0,Computers,3.0,1,en,http://books.google.com/books?id=SbSbdkqibwIC&pg=PA21&dq=cloud+computing&hl=&cd=14&source=gbs_api,https://play.google.com/store/books/details?id=SbSbdkqibwIC&source=gbs_api,9781849962414.0,1849962413,169.0,USD,False,cloud computing,http://books.google.com/books/content?id=SbSbdkqibwIC&printsec=frontcover&img=1&zoom=1&edge=curl&source=gbs_api,2010
IgVTDwAAQBAJ,Cloud Computing,Concepts and Practices,"Naresh Kumar Sehgal, Pramod Chandra P. Bhatt",Springer,2018-03-23,"This book provides readers with an overview of Cloud Computing, starting with historical background on mainframe computers and early networking protocols, leading to current concerns such as hardware and systems security, performance, emerging areas of IoT, Edge Computing etc. Readers will benefit from the in-depth discussion of cloud computing usage and the underlying architecture, with focus on best practices for using a dynamic cloud infrastructure, cloud operations management and cloud security. The authors explain carefully the “why’s and how’s” of Cloud Computing, so engineers will find this book and invaluable introduction to the topic.",284.0,Technology & Engineering,5.0,1,en,http://books.google.com/books?id=IgVTDwAAQBAJ&printsec=frontcover&dq=cloud+computing&hl=&cd=53&source=gbs_api,https://play.google.com/store/books/details?id=IgVTDwAAQBAJ&source=gbs_api,9783319778396.0,3319778390,109.0,USD,False,cloud computing,http://books.google.com/books/content?id=IgVTDwAAQBAJ&printsec=frontcover&img=1&zoom=1&edge=curl&source=gbs_api,2018
bO1mDwAAQBAJ,Hands-On Security in DevOps,"Ensure continuous security, deployment, and delivery with DevSecOps",Tony Hsiang-Chih Hsu,Packt Publishing Ltd,2018-07-30,"Protect your organization's security at all levels by introducing the latest strategies for securing DevOps Key Features Integrate security at each layer of the DevOps pipeline Discover security practices to protect your cloud services by detecting fraud and intrusion Explore solutions to infrastructure security using DevOps principles Book Description DevOps has provided speed and quality benefits with continuous development and deployment methods, but it does not guarantee the security of an entire organization. Hands-On Security in DevOps shows you how to adopt DevOps techniques to continuously improve your organization’s security at every level, rather than just focusing on protecting your infrastructure. This guide combines DevOps and security to help you to protect cloud services, and teaches you how to use techniques to integrate security directly in your product. You will learn how to implement security at every layer, such as for the web application, cloud infrastructure, communication, and the delivery pipeline layers. With the help of practical examples, you’ll explore the core security aspects, such as blocking attacks, fraud detection, cloud forensics, and incident response. In the concluding chapters, you will cover topics on extending DevOps security, such as risk assessment, threat modeling, and continuous security. By the end of this book, you will be well-versed in implementing security in all layers of your organization and be confident in monitoring and blocking attacks throughout your cloud services. What you will learn Understand DevSecOps culture and organization Learn security requirements, management, and metrics Secure your architecture design by looking at threat modeling, coding tools and practices Handle most common security issues and explore black and white-box testing tools and practices Work with security monitoring toolkits and online fraud detection rules Explore GDPR and PII handling case studies to understand the DevSecOps lifecycle Who this book is for Hands-On Security in DevOps is for system administrators, security consultants, and DevOps engineers who want to secure their entire organization. Basic understanding of Cloud computing, automation frameworks, and programming is necessary.",341.0,Computers,5.0,1,en,http://books.google.com/books?id=bO1mDwAAQBAJ&printsec=frontcover&dq=devops&hl=&cd=10&source=gbs_api,https://play.google.com/store/books/details?id=bO1mDwAAQBAJ&source=gbs_api,9781788992411.0,1788992415,39.99,USD,True,devops,http://books.google.com/books/content?id=bO1mDwAAQBAJ&printsec=frontcover&img=1&zoom=1&edge=curl&source=gbs_api,2018
Rxl5CgAAQBAJ,Calculus Made Easy,Being a Very-Simplest Introduction to Those Beautiful Methods of Reckoning Which are Generally Called by the Terrifying Names of the Differential Calculus and the Integral Calculus,Silvanus Phillips Thompson,Read Books Ltd,2011-03-23,"Calculus Made Easy by Silvanus Phillips Thompson is an accessible and engaging introduction to the fundamental principles of calculus, offering readers a clear and simplified approach to understanding this essential branch of mathematics. Calculus Made Easy by Silvanus Phillips Thompson is a timeless classic that makes the complex world of calculus accessible to students and learners of all levels. This book serves as a comprehensive guide to the core concepts and techniques of calculus, presented in a manner that is easy to grasp and enjoyable to read. The book begins by providing readers with a user-friendly introduction to the basic principles of calculus, offering insights into its historical development and significance in mathematics and science. Silvanus Phillips Thompson's clear and engaging explanations set the stage for a deeper exploration of this essential subject. Central to the book is the presentation of calculus concepts, including differentiation and integration, in a simplified and intuitive manner. Readers will find practical examples, step-by-step explanations, and exercises that facilitate learning and problem-solving. Furthermore, the book emphasizes the real-world applications of calculus, illustrating how it is used in various fields, from physics and engineering to economics and biology. It highlights the practical relevance of calculus in solving everyday problems and making informed decisions. Calculus Made Easy is not only a textbook but also a friendly companion on the journey to mastering calculus. It encourages readers to overcome the fear of complex mathematics and discover the beauty and utility of calculus in a straightforward and enjoyable way.",233.0,Mathematics,4.0,1,en,http://books.google.com/books?id=Rxl5CgAAQBAJ&printsec=frontcover&dq=mathematics+calculus&hl=&cd=14&source=gbs_api,https://play.google.com/store/books/details?id=Rxl5CgAAQBAJ&source=gbs_api,9781446547724.0,1446547728,9.99,USD,True,mathematics calculus,http://books.google.com/books/content?id=Rxl5CgAAQBAJ&printsec=frontcover&img=1&zoom=1&edge=curl&source=gbs_api,2011
