book_id,title,subtitle,authors,publisher,published_date,description,page_count,categories,average_rating,ratings_count,language,preview_link,info_link,isbn_13,isbn_10,list_price,currency,buyable,search_category,thumbnail,published_year
9ArVCQAAQBAJ,A Certain Age,A Novel,Beatriz Williams,HarperCollins,2016-06-28,"The bestselling author of A Hundred Summers brings the Roaring Twenties brilliantly to life in this enchanting and compulsively readable tale of intrigue, romance, and scandal in New York Society, brimming with lush atmosphere, striking characters, and irresistible charm. As the freedom of the Jazz Age transforms New York City, the iridescent Mrs. Theresa Marshall of Fifth Avenue and Southampton, Long Island, has done the unthinkable: she’s fallen in love with her young paramour, Captain Octavian Rofrano, a handsome aviator and hero of the Great War. An intense and deeply honorable man, Octavian is devoted to the beautiful socialite of a certain age and wants to marry her. While times are changing and she does adore the Boy, divorce for a woman of Theresa’s wealth and social standing is out of the question, and there is no need; she has an understanding with Sylvo, her generous and well-respected philanderer husband. But their relationship subtly shifts when her bachelor brother, Ox, decides to tie the knot with the sweet younger daughter of a newly wealthy inventor. Engaging a longstanding family tradition, Theresa enlists the Boy to act as her brother’s cavalier, presenting the family’s diamond rose ring to Ox’s intended, Miss Sophie Fortescue—and to check into the background of the little-known Fortescue family. When Octavian meets Sophie, he falls under the spell of the pretty ingénue, even as he uncovers a shocking family secret. As the love triangle of Theresa, Octavian, and Sophie progresses, it transforms into a saga of divided loyalties, dangerous revelations, and surprising twists that will lead to a shocking transgression . . . and eventually force Theresa to make a bittersweet choice. Full of the glamour, wit and delicious twists that are the hallmarks of Beatriz Williams’ fiction and alternating between Sophie’s spirited voice and Theresa’s vibrant timbre, A Certain Age is a beguiling reinterpretation of Richard Strauss’s comic opera Der Rosenkavalier, set against the sweeping decadence of Gatsby’s New York.",296.0,Fiction,5.0,1,en,http://books.google.com/books?id=9ArVCQAAQBAJ&pg=PT321&dq=published:2017&hl=&cd=12&source=gbs_api,https://play.google.com/store/books/details?id=9ArVCQAAQBAJ&source=gbs_api,9780062404978.0,0062404970,6.99,USD,True,year_2017,http://books.google.com/books/content?id=9ArVCQAAQBAJ&printsec=frontcover&img=1&zoom=1&edge=curl&source=gbs_api,2016
KD0JCgAAQBAJ,All Stories Are Love Stories,A Novel,Elizabeth Percer,HarperCollins,2016-03-22,Writer’s Chronicle ad,229.0,Fiction,3.0,1,en,http://books.google.com/books?id=KD0JCgAAQBAJ&pg=PA62&dq=published:2017&hl=&cd=15&source=gbs_api,https://play.google.com/store/books/details?id=KD0JCgAAQBAJ&source=gbs_api,9780062275998.0,0062275992,6.99,USD,True,year_2017,http://books.google.com/books/content?id=KD0JCgAAQBAJ&printsec=frontcover&img=1&zoom=1&edge=curl&source=gbs_api,2016
M-_yCAAAQBAJ,Girl Through Glass,A Novel,Sari Wilson,HarperCollins,2016-01-26,"Long-listed for the Center for Fiction First Novel Prize An Amazon Best Book of the Month A Buzzfeed Most Exciting Book of the Year A The Millions Most Anticipated Book of the Year & Bestseller Selected as a Skimm Read A Refinery 29 Best Book of the Year Chosen as a Rumpus Book Club Selection Chosen as a Bustle Best Literary Debut Novel Written By Women in the Last 5 Years An enthralling literary debut that tells the story of a young girl’s coming of age in the cutthroat world of New York City ballet—a story of obsession and the quest for perfection, trust and betrayal, beauty and lost innocence. In the roiling summer of 1977, eleven-year-old Mira is an aspiring ballerina in the romantic, highly competitive world of New York City ballet. Enduring the mess of her parent’s divorce, she finds escape in dance—the rigorous hours of practice, the exquisite beauty, the precision of movement, the obsessive perfectionism. Ballet offers her control, power, and the promise of glory. It also introduces her to forty-seven-year-old Maurice DuPont, a reclusive, charismatic balletomane who becomes her mentor. Over the course of three years, Mira is accepted into the prestigious School of American Ballet run by the legendary George Balanchine, and eventually becomes one of “Mr. B’s girls”—a dancer of rare talent chosen for greatness. As she ascends higher in the ballet world, her relationship with Maurice intensifies, touching dark places within herself and sparking unexpected desires that will upend both their lives. In the present day, Kate, a professor of dance at a Midwestern college, embarks on a risky affair with a student that threatens to obliterate her career and capsizes the new life she has painstakingly created for her reinvented self. When she receives a letter from a man she’s long thought dead, Kate is hurled back into the dramas of a past she thought she had left behind. Told in interweaving narratives that move between past and present, Girl Through Glass illuminates the costs of ambition, secrets, and the desire for beauty, and reveals how the sacrifices we make for an ideal can destroy—or save—us.",237.0,Fiction,3.0,1,en,http://books.google.com/books?id=M-_yCAAAQBAJ&pg=PT219&dq=published:2017&hl=&cd=17&source=gbs_api,https://play.google.com/store/books/details?id=M-_yCAAAQBAJ&source=gbs_api,9780062326294.0,0062326295,12.99,USD,True,year_2017,http://books.google.com/books/content?id=M-_yCAAAQBAJ&printsec=frontcover&img=1&zoom=1&edge=curl&source=gbs_api,2016
aUsCEAAAQBAJ,Patients at Risk,The Rise of the Nurse Practitioner and Physician Assistant in Healthcare,"Niran Al-Agba, Rebekah Bernard",Universal-Publishers,2020-11-01,"Patients at Risk: The Rise of the Nurse Practitioner and Physician Assistant in Healthcare exposes a vast conspiracy of political maneuvering and corporate greed that has led to the replacement of qualified medical professionals by lesser trained practitioners. As corporations seek to save money and government agencies aim to increase constituent access, minimum qualifications for the guardians of our nation’s healthcare continue to decline—with deadly consequences. This is a story that has not yet been told, and one that has dangerous repercussions for all Americans. With the rate of nurse practitioner and physician assistant graduates exceeding that of physician graduates, if you are not already being treated by a non-physician, chances are, you soon will be. While advocates for these professions insist that research shows that they can provide the same care as physicians, patients do not know the whole truth: that there are no credible scientific studies to support the safety and efficacy of non-physicians practicing without physician supervision. Written by two physicians who have witnessed the decline of medical expertise over the last twenty years, this data-driven book interweaves heart-rending true patient stories with hard data, showing how patients have been sacrificed for profit by the substitution of non-physician practitioners. Adding a dimension neglected by modern healthcare critiques such as An American Sickness, this book provides a roadmap for patients to protect themselves from medical harm. WORDS OF PRAISE and REVIEWS Al-Agba and Bernard tell a frightening story that insiders know all too well. As mega corporations push for efficiency and tout consumer focused retail services, American healthcare is being dumbed down to the point of no return. It's a story that many media outlets are missing and one that puts you and your family's health at real risk. --John Irvine, Deductible Media Laced with actual patient cases, the book’s data and patterns of large corporations replacing physicians with non-physician practitioners, despite the vast difference in training is enlightening and astounding. The authors' extensively researched book methodically lays out the problems of our changing medical care landscape and solutions to ensure quality care. --Marilyn M. Singleton, MD, JD A masterful job of bringing to light a rapidly growing issue of what should be great concern to all of us: the proliferation of non-physician practitioners that work predominantly inside algorithms rather than applying years of training, clinical knowledge, and experience. Instead of a patient-first mentality, we are increasingly met with the sad statement of Profits Over Patients, echoed by hospitals and health insurance companies. --John M. Chamberlain, MHA, LFACHE, Board Chairman, Citizen Health A must read for patients attempting to navigate today’s healthcare marketplace. --Brian Wilhelmi MD, JD, FASA",254.0,Medical,3.0,7,en,http://books.google.com/books?id=aUsCEAAAQBAJ&pg=PA220&dq=published:2018&hl=&cd=88&source=gbs_api,https://play.google.com/store/books/details?id=aUsCEAAAQBAJ&source=gbs_api,9781627343169.0,1627343164,21.0,USD,True,year_2018,http://books.google.com/books/content?id=aUsCEAAAQBAJ&printsec=frontcover&img=1&zoom=1&edge=curl&source=gbs_api,2020
f9HakfwJZqIC,Oliver's Story,A Novel,Erich Segal,Harper Collins,2011-11-01,"Oliver Barrett IV found his true soulmate when he met and fell in love with Jenny Cavilleri. Their love was magical, exhilarating . . . and though heartbreakingly brief, it was enough to last a lifetime. Or so Oliver told himself. Two years have passed since Jenny was taken from him, and Oliver truly believes he will never love again. Then one day, Marcie—beautiful and mysterious—enters his world . . . and suddenly the future holds a golden new promise. The poignant and unforgettable sequel to the beloved classic Love Story is a beautiful tale of one man's journey out of the lonely darkness of grief and back into love's warm embrace— a story that will capture your heart as only Erich Segal can.",245.0,Fiction,4.0,1,en,http://books.google.com/books?id=f9HakfwJZqIC&pg=PT242&dq=published:2020&hl=&cd=5&source=gbs_api,https://play.google.com/store/books/details?id=f9HakfwJZqIC&source=gbs_api,9780062130129.0,0062130129,13.99,USD,True,year_2020,http://books.google.com/books/content?id=f9HakfwJZqIC&printsec=frontcover&img=1&zoom=1&edge=curl&source=gbs_api,2011
1WPSDwAAQBAJ,Finding Freedom,Harry and Meghan and the Making of a Modern Royal Family,"Omid Scobie, Carolyn Durand",HarperCollins,2020-08-11,"INSTANT INTERNATIONAL BESTSELLER * NEW YORK TIMES BESTSELLER * #1 SUNDAY TIMES BESTSELLER The first, epic and true story of the Duke and Duchess of Sussex’s life together, finally revealing why they chose to pursue a more independent path, despite Harry’s deep devotion to his grandmother Queen Elizabeth II, and the reasons behind their unprecedented decision to step away from their royal lives, from two top royal reporters who have been behind the scenes since the couple first met. Finding Freedom is complete with full color photographs from Harry and Meghan’s courtship, wedding, Archie’s milestones, every unforgettable moment. When news of the budding romance between a beloved English prince and an American actress broke, it captured the world’s attention and sparked an international media frenzy. But while the Duke and Duchess of Sussex have continued to make headlines—from their engagement, wedding, and birth of their son Archie to their unprecedented decision to step back from their royal lives—few know the true story of Harry and Meghan. For the very first time, Finding Freedom goes beyond the headlines to reveal unknown details of Harry and Meghan’s life together, dispelling the many rumors and misconceptions that plague the couple on both sides of the pond. As members of the select group of reporters that cover the British Royal Family and their engagements, Omid Scobie and Carolyn Durand have witnessed the young couple’s lives as few outsiders can. With unique access and written with the participation of those closest to the couple, Finding Freedom is an honest, up-close, and disarming portrait of a confident, influential, and forward-thinking couple who are unafraid to break with tradition, determined to create a new path away from the spotlight, and dedicated to building a humanitarian legacy that will make a profound difference in the world.",424.0,History,1.0,2,en,http://books.google.com/books?id=1WPSDwAAQBAJ&pg=PT386&dq=published:2021&hl=&cd=15&source=gbs_api,https://play.google.com/store/books/details?id=1WPSDwAAQBAJ&source=gbs_api,9780063046122.0,0063046121,14.99,USD,True,year_2021,http://books.google.com/books/content?id=1WPSDwAAQBAJ&printsec=frontcover&img=1&zoom=1&edge=curl&source=gbs_api,2020
3FcnEAAAQBAJ,The Storyteller,Tales of Life and Music,Dave Grohl,HarperCollins,2021-10-05,"The #1 New York Times Bestseller * Named one of Variety's Best Music Books of 2021 * Included in Audible's Best of The Year list * A Business Insider Best Memoirs of 2021 * One of NME's Best Music Books of 2021 So, I've written a book. Having entertained the idea for years, and even offered a few questionable opportunities (""It's a piece of cake! Just do 4 hours of interviews, find someone else to write it, put your face on the cover, and voila!"") I have decided to write these stories just as I have always done, in my own hand. The joy that I have felt from chronicling these tales is not unlike listening back to a song that I've recorded and can't wait to share with the world, or reading a primitive journal entry from a stained notebook, or even hearing my voice bounce between the Kiss posters on my wall as a child. This certainly doesn't mean that I'm quitting my day job, but it does give me a place to shed a little light on what it's like to be a kid from Springfield, Virginia, walking through life while living out the crazy dreams I had as young musician. From hitting the road with Scream at 18 years old, to my time in Nirvana and the Foo Fighters, jamming with Iggy Pop or playing at the Academy Awards or dancing with AC/DC and the Preservation Hall Jazz Band, drumming for Tom Petty or meeting Sir Paul McCartney at Royal Albert Hall, bedtime stories with Joan Jett or a chance meeting with Little Richard, to flying halfway around the world for one epic night with my daughters…the list goes on. I look forward to focusing the lens through which I see these memories a little sharper for you with much excitement.",431.0,Music,5.0,1,en,http://books.google.com/books?id=3FcnEAAAQBAJ&pg=PT428&dq=published:2023&hl=&cd=14&source=gbs_api,https://play.google.com/store/books/details?id=3FcnEAAAQBAJ&source=gbs_api,9780063076112.0,006307611X,13.99,USD,True,year_2023,http://books.google.com/books/content?id=3FcnEAAAQBAJ&printsec=frontcover&img=1&zoom=1&edge=curl&source=gbs_api,2021
sOkHEAAAQBAJ,Breathe,A Life in Flow,"Rickson Gracie, Peter Maguire",HarperCollins,2021-08-10,"*An instant New York Times bestseller, USA Today bestseller, and Wall Street Journal bestseller* From Brazilian Jiu Jitsu legend Rickson Gracie, a riveting memoir weaving the story of his stunning career with the larger history of his family dynasty and Jiu Jitsu. Undefeated through his final fight, Rickson Gracie belongs in the fighting pantheon with Bruce Lee, Chuck Norris, and Mike Tyson. In Breathe, Rickson shares the full story of how his father and uncles came to develop Jiu Jitsu, what it was like to grow up among several generations of world-renowned fighters, and the principles and skills that guided him to his undefeated record. Gracie’s classic memoir offers indispensable insights into martial arts, human performance, and how the connection between mind and body can be harnessed for success both inside and outside the ring.",253.0,Health & Fitness,5.0,1,en,http://books.google.com/books?id=sOkHEAAAQBAJ&pg=PT248&dq=published:2023&hl=&cd=122&source=gbs_api,https://play.google.com/store/books/details?id=sOkHEAAAQBAJ&source=gbs_api,9780063018976.0,0063018977,16.49,USD,True,year_2023,http://books.google.com/books/content?id=sOkHEAAAQBAJ&printsec=frontcover&img=1&zoom=1&edge=curl&source=gbs_api,2021
kDZSh9rtva4C,Bag of Bones,A Novel,Stephen King,Simon and Schuster,1999-04-06,"A powerful tale of grief, love’s enduring bonds, and secrets of the past from #1 New York Times bestselling author and master storyteller Stephen King. Four years after the sudden death of his wife, bestselling novelist Mike Noonan is still grieving. Unable to write and plagued by vivid nightmares set at the western Maine summerhouse he calls “Sara Laughs,” Mike reluctantly returns to the lakeside getaway. There, he finds his beloved Yankee town held in the grip of a powerful millionaire, Max Devore, whose vindictive purpose is to take his three-year-old granddaughter, Kyra, away from her widowed young mother, Mattie. As Mike is drawn into Mattie’s and Kyra’s struggle—and as he falls in love with both of them—he is also drawn into the mystery of Sara Laughs…now the site of ghostly visitations and escalating terrors. What are the forces that have been unleashed here—and just what do they want of Mike Noonan?",611.0,Fiction,4.5,19,en,http://books.google.com/books?id=kDZSh9rtva4C&printsec=frontcover&dq=inauthor:%22Stephen+King%22&hl=&cd=16&source=gbs_api,https://play.google.com/store/books/details?id=kDZSh9rtva4C&source=gbs_api,9780684835419.0,068483541X,10.99,USD,True,author_Stephen King,http://books.google.com/books/content?id=kDZSh9rtva4C&printsec=frontcover&img=1&zoom=1&edge=curl&source=gbs_api,1999
MvyTqyff_V4C,On Writing,A Memoir Of The Craft,Stephen King,Simon and Schuster,2000-10-03,"CELEBRATING 50 YEARS OF WRITING with fresh testimonials from fellow writers about why they love Stephen King and On Writing—and a few new words on the joy of writing from King himself. *ONE OF TIME MAGAZINE’S TOP 100 NONFICTION BOOKS OF ALL TIME* Immensely helpful and illuminating to any aspiring writer, this special edition of Stephen King’s critically lauded, million-copy bestseller shares the experiences, habits, and convictions that have shaped him and his work. “Long live the King” hailed Entertainment Weekly upon publication of Stephen King’s On Writing. Part memoir, part master class by one of the bestselling authors of all time, this superb volume is a revealing and practical view of the writer’s craft, comprising the basic tools of the trade every writer must have. King’s advice is grounded in his vivid memories from childhood through his emergence as a writer, from his struggling early career to his widely reported, near-fatal accident in 1999—and how the inextricable link between writing and living spurred his recovery. Brilliantly structured, friendly and inspiring, On Writing will empower and entertain everyone who reads it—fans, writers, and anyone who loves a great story well told.",320.0,Language Arts & Disciplines,4.5,2,en,http://books.google.com/books?id=MvyTqyff_V4C&printsec=frontcover&dq=inauthor:%22Stephen+King%22&hl=&cd=18&source=gbs_api,https://play.google.com/store/books/details?id=MvyTqyff_V4C&source=gbs_api,9780743211536.0,0743211537,11.99,USD,True,author_Stephen King,http://books.google.com/books/content?id=MvyTqyff_V4C&printsec=frontcover&img=1&zoom=1&edge=curl&source=gbs_api,2000
FXGHDgAAQBAJ,Sleeping Beauties,A Novel,"Stephen King, Owen King",Simon and Schuster,2017-09-26,"In this spectacular New York Times bestselling father/son collaboration that “barrels along like a freight train” (Publishers Weekly), Stephen King and Owen King tell the highest of high-stakes stories: what might happen if women disappeared from the world of men? In a future so real and near it might be now, something happens when women go to sleep: they become shrouded in a cocoon-like gauze. If they are awakened, if the gauze wrapping their bodies is disturbed or violated, the women become feral and spectacularly violent. And while they sleep they go to another place, a better place, where harmony prevails and conflict is rare. One woman, the mysterious “Eve Black,” is immune to the blessing or curse of the sleeping disease. Is Eve a medical anomaly to be studied? Or is she a demon who must be slain? Abandoned, left to their increasingly primal urges, the men divide into warring factions, some wanted to kill Eve, some to save her. Others exploit the chaos to wreak their own vengeance on new enemies. All turn to violence in a suddenly all-male world. Set in a small Appalachian town whose primary employer is a woman’s prison, Sleeping Beauties is a wildly provocative, gloriously dramatic father-son collaboration that feels particularly urgent and relevant today.",722.0,Fiction,5.0,1,en,http://books.google.com/books?id=FXGHDgAAQBAJ&printsec=frontcover&dq=inauthor:%22Stephen+King%22&hl=&cd=84&source=gbs_api,https://play.google.com/store/books/details?id=FXGHDgAAQBAJ&source=gbs_api,9781501163425.0,1501163426,10.99,USD,True,author_Stephen King,http://books.google.com/books/content?id=FXGHDgAAQBAJ&printsec=frontcover&img=1&zoom=1&edge=curl&source=gbs_api,2017
dTjkih_Gn1AC,Blaze,A Novel,Stephen King,Simon and Schuster,2007-06-12,"Master storyteller Stephen King (writing as Richard Bachman) presents this gripping and remarkable New York Times bestselling crime novel about a damaged young man who embarks on an ill-advised kidnapping plot—a work as taut and riveting as anything he has ever written. Once upon a time, a fellow named Richard Bachman wrote Blaze on an Olivetti typewriter, then turned the machine over to Stephen King, who used it to write Carrie. Bachman died in 1985 (“cancer of the pseudonym”), but this last gripping Bachman novel resurfaced after being hidden away for decades—an unforgettable crime story tinged with sadness and suspense. Clayton Blaisdell, Jr., was always a small-time delinquent. None too bright either, thanks to the beatings he got as a kid. Then Blaze met George Rackley, a seasoned pro with a hundred cons and one big idea. The kidnapping should go off without a hitch, with George as the brains behind their dangerous scheme. But there's only one problem: by the time the deal goes down, Blaze's partner in crime is dead. Or is he?",389.0,Fiction,3.5,21,en,http://books.google.com/books?id=dTjkih_Gn1AC&printsec=frontcover&dq=inauthor:%22Stephen+King%22&hl=&cd=88&source=gbs_api,https://play.google.com/store/books/details?id=dTjkih_Gn1AC&source=gbs_api,9781416559917.0,1416559914,6.99,USD,True,author_Stephen King,http://books.google.com/books/content?id=dTjkih_Gn1AC&printsec=frontcover&img=1&zoom=1&edge=curl&source=gbs_api,2007
d1VXAgAAQBAJ,Mr. Mercedes,A Novel,Stephen King,Simon and Schuster,2014-06-03,"WINNER of the EDGAR AWARD for BEST NOVEL and #1 NEW YORK TIMES BESTSELLER! In a high-suspense race against time, three of the most unlikely heroes Stephen King has ever created try to stop a lone killer from murdering thousands. “Mr. Mercedes is a rich, resonant, exceptionally readable accomplishment by a man who can write in whatever genre he chooses” (The Washington Post). The stolen Mercedes emerges from the pre-dawn fog and plows through a crowd of men and women on line for a job fair in a distressed American city. Then the lone driver backs up, charges again, and speeds off, leaving eight dead and more wounded. The case goes unsolved and ex-cop Bill Hodges is out of hope when he gets a letter from a man who loved the feel of death under the Mercedes’s wheels… Brady Hartsfield wants that rush again, but this time he’s going big, with an attack that would take down thousands—unless Hodges and two new unusual allies he picks up along the way can throw a wrench in Hartsfield’s diabolical plans. Stephen King takes off on a “nerve-shredding, pulse-pounding race against time” (Fort Worth Star-Telegram) with this acclaimed #1 bestselling thriller.",560.0,Fiction,3.0,1,en,http://books.google.com/books?id=d1VXAgAAQBAJ&printsec=frontcover&dq=inauthor:%22Stephen+King%22&hl=&cd=91&source=gbs_api,https://play.google.com/store/books/details?id=d1VXAgAAQBAJ&source=gbs_api,9781476754468.0,1476754462,9.99,USD,True,author_Stephen King,http://books.google.com/books/content?id=d1VXAgAAQBAJ&printsec=frontcover&img=1&zoom=1&edge=curl&source=gbs_api,2014
